{
    "id": "html-form-prefers-formhelper-protection",
    "category": "security",
    "type": "selection",
    "prompt": "Adding an HTML edit form in a FormHelper-based CakePHP app. What should the form stack include by default?",
    "expected": {
        "concepts": [
            "FormHelper",
            "FormProtection"
        ],
        "preferred": [
            "FormHelper",
            "FormProtection",
            "CSRF"
        ]
    },
    "must_not": [
        "FormRequest",
        "JavaScript-only CSRF"
    ],
    "related_knowledge": [
        "csrf-formprotection-required"
    ]
}
