{
    "id": "crud-api-serialization-must-hide-secrets",
    "category": "crud",
    "type": "selection",
    "requires": {
        "extensions": [
            "friendsofcake-crud"
        ]
    },
    "prompt": "CRUD Api listener serializes User entities including password hashes. What should we fix?",
    "expected": {
        "concepts": [
            "serialization",
            "_hidden"
        ],
        "preferred": [
            "_hidden",
            "hide password",
            "API shaping"
        ]
    },
    "must_not": [
        "leave password hashes in default serialization"
    ],
    "related_knowledge": [
        "serialization-overexposure"
    ]
}
