{
    "id": "reusable-controller-helper-prefers-component",
    "category": "architecture",
    "type": "selection",
    "prompt": "Several controllers share a small HTTP-only helper for building flash + redirect pairs after form posts. Where should that live by default?",
    "expected": {
        "concepts": [
            "component"
        ],
        "preferred": [
            "Component"
        ]
    },
    "must_not": [
        "put it in middleware by default",
        "put persistence in the component"
    ],
    "related_knowledge": [
        "component-vs-middleware"
    ]
}
